{"schema":"legacyforge-native-capability-receipt-v3","case_id":"D06-RES01a","source_commit":"4457142ff1fd9e01371eb446612c70162ce93357","build_id":"20261017-183031-15ba7835","production_comparison_commit":"d1453434ceefe73bef5aff497194e09f39dde7e1","frozen_d00_reference_commit":"553c6554f40f1372b0ea09f6badbbb98e133a9ab","frozen_hw01_reference_commit":"a3f72874241914f6048d4ca9ec4fc0edc978625d","frozen_fmt01_reference_commit":"bbe3a42c422e4328d5f98c07a9370fa948d0cbbf","package_name":"AlgorHome.LegacyForge.NativeDiagnostics","package_publisher":"CN=LegacyForgeDiagnostics","package_version":"0.2.2.0","architecture":"x64","application_id":"App","expected_package_identity":true,"run_id":"7A897A91-DE14-4A33-82AE-4737F5575C6D","process_instance_id":"12DB5ECA-0A71-4310-BB19-E8E1B64FA742","java_jni_enabled":false,"minecraft_or_gameplay_tested":false,"all_d06_certified":false,"hardware_device_requested":true,"watchdog_cancels_native_calls":false,"payload_hashes":{"executable_sha256":"cb08435285c6dad6f0eba7b0be955f4243d52d29bf575cacfcef4aa6facfbd67","manifest_sha256":"82f0b634c4343a5272af9f873d1accc528970407da0dce1913deeb1704ccc3c0","build_inputs_sha256":"d7fcb2e1ac04e3013a37dcca473ea24e402ce165de1f7460efbd7924de9b8a1e","policy_sha256":"ec8a12dda98ecfbcaac14ff647c329867d7e386aebcf4d6d0d4e48812348c0e2","schema_sha256":"cd2ba13e2da44ead0cb3f421d88138596cca6541e86105daed7e892883029180","inventory_sha256":"d5abc15a2bd38f06d749fd371855302b74861eebc8f46ddab0d03e9bdf42fbe4"},"status":"PASS","reason":"RGBA8_TEXTURE_CREATED_DESCRIPTOR_MATCH","stage":"FINAL","terminal":true,"sequence":4,"elapsed_monotonic_ms":62,"deadline_ms":10000,"observed_at_utc":"2026-10-17T23:43:07.619Z","last_durable_checkpoint_stage":"BEFORE_CREATE_TEXTURE","receipt_persistence_result":"VERIFY_BY_RETRIEVAL","details":{"requested_driver_type":"HARDWARE","requested_driver_type_value":1,"requested_feature_level":45056,"creation_flags":32,"software_fallback_allowed":false,"render_or_present_tested":false,"requested_descriptor":{"width":1,"height":1,"mip_levels":1,"array_size":1,"format":28,"sample_count":1,"sample_quality":0,"usage":0,"bind_flags":8,"cpu_access_flags":0,"misc_flags":0},"format_name":"DXGI_FORMAT_R8G8B8A8_UNORM","format_value":28,"initial_data_supplied":false,"nonnull_output_pointer":true,"texture_attempted":true,"get_desc_called":true,"memory_before":{"usage_bytes":4927488,"limit_bytes":1073741824,"available":true},"creation_hresult":"0x00000000","creation_hresult_signed":0,"selected_feature_level":45056,"device_returned":true,"context_returned":true,"get_adapter_hresult":"0x00000000","get_desc_hresult":"0x00000000","adapter_flags":0,"adapter_software_flag":false,"texture_hresult":"0x00000000","texture_hresult_signed":0,"texture_returned":true,"returned_descriptor":{"width":1,"height":1,"mip_levels":1,"array_size":1,"format":28,"sample_count":1,"sample_quality":0,"usage":0,"bind_flags":8,"cpu_access_flags":0,"misc_flags":0},"descriptors_match":true,"texture_reference_released":true,"test_resources_released":true,"memory_after_release":{"usage_bytes":9994240,"limit_bytes":1073741824,"available":true}}}